{
  "$schema": "../typography-evidence.schema.json",
  "schemaVersion": 1,
  "evidenceKind": "physical-device",
  "platform": "ios",
  "profileId": "operate",
  "surfaceId": "example-type-100",
  "fontScale": 1,
  "policy": {
    "minimumHeadingRatio": 1.5,
    "minimumBodySize": 14,
    "minimumFunctionalSize": 12,
    "platformFunctionalFloor": 12,
    "minimumLineHeightRatio": 1.25,
    "maximumBodyTrackingEm": 0.08,
    "maximumDisplayViewportRatio": 0.35
  },
  "nodes": [
    {
      "id": "heading-one",
      "owner": "example-heading",
      "order": 0,
      "semanticRole": "heading",
      "fontFamily": "Example Sans",
      "physicalVariant": "ExampleSans-Regular",
      "fontWeight": 400,
      "fontSize": 32,
      "lineHeight": 40,
      "letterSpacingEm": 0,
      "text": "Example body text",
      "lines": 1,
      "italic": false,
      "serif": false,
      "allCaps": false,
      "headingLevel": 1,
      "accessibilityHeading": true,
      "viewportHeight": 800,
      "renderedHeight": 24,
      "iconTileBefore": false,
      "eyebrowChipBefore": false,
      "kickerBefore": false,
      "approvedFont": true,
      "approvedVariant": true,
      "bodyReferenceSize": 16
    },
    {
      "id": "heading-two",
      "owner": "example-subheading",
      "order": 1,
      "semanticRole": "heading",
      "fontFamily": "Example Sans",
      "physicalVariant": "ExampleSans-Regular",
      "fontWeight": 400,
      "fontSize": 24,
      "lineHeight": 32,
      "letterSpacingEm": 0,
      "text": "Example body text",
      "lines": 1,
      "italic": false,
      "serif": false,
      "allCaps": false,
      "headingLevel": 2,
      "accessibilityHeading": true,
      "viewportHeight": 800,
      "renderedHeight": 24,
      "iconTileBefore": false,
      "eyebrowChipBefore": false,
      "kickerBefore": false,
      "approvedFont": true,
      "approvedVariant": true,
      "bodyReferenceSize": 16
    },
    {
      "id": "body",
      "owner": "example-body",
      "order": 2,
      "semanticRole": "body",
      "fontFamily": "Example Sans",
      "physicalVariant": "ExampleSans-Regular",
      "fontWeight": 400,
      "fontSize": 16,
      "lineHeight": 24,
      "letterSpacingEm": 0,
      "text": "Example body text",
      "lines": 1,
      "italic": false,
      "serif": false,
      "allCaps": false,
      "headingLevel": 0,
      "accessibilityHeading": false,
      "viewportHeight": 800,
      "renderedHeight": 24,
      "iconTileBefore": false,
      "eyebrowChipBefore": false,
      "kickerBefore": false,
      "approvedFont": true,
      "approvedVariant": true,
      "bodyReferenceSize": 16
    },
    {
      "id": "label",
      "owner": "example-label",
      "order": 3,
      "semanticRole": "label",
      "fontFamily": "Example Sans",
      "physicalVariant": "ExampleSans-Regular",
      "fontWeight": 400,
      "fontSize": 14,
      "lineHeight": 20,
      "letterSpacingEm": 0,
      "text": "Example body text",
      "lines": 1,
      "italic": false,
      "serif": false,
      "allCaps": false,
      "headingLevel": 0,
      "accessibilityHeading": false,
      "viewportHeight": 800,
      "renderedHeight": 24,
      "iconTileBefore": false,
      "eyebrowChipBefore": false,
      "kickerBefore": false,
      "approvedFont": true,
      "approvedVariant": true,
      "bodyReferenceSize": 16
    }
  ]
}
